Grapheme	IPA	Note
^mundo$	m u n d o	Latin American Spanish pronunciation
^tierra$	t j ɛ r a
^suelo$	s w e l o
^polvo$	p o l β o
^lodo$	l o ð o
^arena$	a ɾ e n a
^montaɲa$	m o n t a ɲ a
^loma$	l o m a
^cerro$	s ɛ r o
^acantilado$	a k a n t i l a ð o
^barranca$	b a r a n k a
^pampa$	p a m p a
^llanura$	ɟ ʝ a n u ɾ a
^campo$	k a m p o
^valle$	b a ʝ e
^isla$	i s l a
^continente$	k o n t i n e n t e
^tierra_firme$	t j ɛ r a + f i ɾ m e
^ribera$	r i β ɛ ɾ a
^playa$	p l a ʝ a
^costa$	k o s t a
^cueva$	k w e β a
^gruta$	ɡ ɾ u t a
^agua$	a ɣ w a
^mar$	m a ɾ
^calma$	k a l m a
^agitado$	a x i t a ð o
^borrascoso$	b o r a s k o s o
^espuma$	ɛ s p u m a
^océano$	o s e a n o
^lago$	l a ɣ o
^golfo$	ɡ o l f o
^bahía$	b a i a
^laguna$	l a ɣ u n a
^arrecife$	a r e s i f e
^promontorio$	p ɾ o m o n t o ɾ j o
^punta$	p u n t a
^ola$	o l a
^marea$	m a ɾ e a
^bajamar$	b a x a m a ɾ
^pleamar$	p l e a m a ɾ
^río$	r i o
^corriente$	k o r j e n t e
^arroyo$	a r o ʝ o
^remolino$	r e m o l i n o
^manantial$	m a n a n t j a l
^pozo$	p o s o
^pantano$	p a n t a n o
^cascada$	k a s k a ð a
^salto$	s a l t o
^bosque$	b o s k e
^selva$	s ɛ l β a
^árbol$	a ɾ β o l
^madera$	m a ð ɛ ɾ a
^piedra$	p j e ð ɾ a
^roca$	r o k a
^terremoto$	t ɛ r e m o t o
^temblor$	t e m b l o ɾ
^cielo$	s j e l o
^sol$	s o l
^luna$	l u n a
^estrella$	ɛ s t ɾ e ʝ a
^relámpago$	r e l a m p a ɣ o
^trueno$	t ɾ w e n o
^rayo$	r a ʝ o
^tempestad$	t e m p ɛ s t a ð
^tormenta$	t o ɾ m e n t a
^arco_iris$	a ɾ k o + i ɾ i s
^luz$	l u s
^oscuridad$	o s k u ɾ i ð a ð
^tinieblas$	t i n j e β l a s
^sombra$	s o m b ɾ a
^rocío$	r o s i o
^aire$	a i ɾ e
^viento$	b j e n t o
^nube$	n u β e
^neblina$	n e β l i n a
^niebla$	n j e β l a
^lluvia$	ɟ ʝ u β j a
^nieve$	n j e β e
^hielo$	ɟ ʝ e l o
^tiempo$	t j e m p o
^fuego$	f w e ɣ o
^llama$	ɟ ʝ a m a
^humo$	u m o
^cenizas$	s e n i s a s
^brasas$	b ɾ a s a s
^quemar$	k e m a ɾ
^quemarse$	k e m a ɾ s e
^arder$	a ɾ ð ɛ ɾ
^encender$	e n s e n d ɛ ɾ
^apagar$	a p a ɣ a ɾ
^extinguir$	ɛ k s t i n ɡ i ɾ
^fósforo$	f o s f o ɾ o
^cerilla$	s ɛ ɾ i ʝ a
^leɲa$	l e ɲ a
^carbón$	k a ɾ β o n
^mover$	m o β ɛ ɾ
^volcar$	b o l k a ɾ
^dar_vuelta$	d a ɾ + β w ɛ l t a
^dar_vuelta$	d a ɾ + β w ɛ l t a
^voltear$	b o l t e a ɾ
^enrollar$	e n r o ʝ a ɾ
^envolver$	e m b o l β ɛ ɾ
^rodar$	r o ð a ɾ
^arrollar$	a r o ʝ a ɾ
^enrollar$	e n r o ʝ a ɾ
^dejar_caer$	d e x a ɾ + k a ɛ ɾ
^torcer$	t o ɾ s ɛ ɾ
^ascender$	a s e n d ɛ ɾ
^subir$	s u β i ɾ
^levantar$	l e β a n t a ɾ
^caer$	k a ɛ ɾ
^gotear$	ɡ o t e a ɾ
^escurrir$	ɛ s k u r i ɾ
^echar$	e tʃ a ɾ
^tirar$	t i ɾ a ɾ
^coger$	k o x ɛ ɾ
^sacudir$	s a k u ð i ɾ
^fluir$	f l w i ɾ
^correr$	k o r ɛ ɾ
^hundir$	u n d i ɾ
^flotar$	f l o t a ɾ
^nadar$	n a ð a ɾ
^zambullirse$	s a m b u ʝ i ɾ s e
^salpicar$	s a l p i k a ɾ
^navegar$	n a β e ɣ a ɾ
^volar$	b o l a ɾ
^soplar$	s o p l a ɾ
^gatear$	ɡ a t e a ɾ
^arrodillarse$	a r o ð i ʝ a ɾ s e
^agacharse$	a ɣ a tʃ a ɾ s e
^ponerse_en_cuclillas$	p o n ɛ ɾ s ɛ + e n + k u k l i ʝ a s
^resbalar$	r ɛ s β a l a ɾ
^saltar$	s a l t a ɾ
^brincar$	b ɾ i n k a ɾ
^patear$	p a t e a ɾ
^bailar$	b a i l a ɾ
^caminar$	k a m i n a ɾ
^andar$	a n d a ɾ
^lisiar$	l i s j a ɾ
^correr$	k o r ɛ ɾ
^ir$	i ɾ
^subir$	s u β i ɾ
^trepar$	t ɾ e p a ɾ
^bajar$	b a x a ɾ
^descender$	d e s e n d ɛ ɾ
^salir$	s a l i ɾ
^venir$	b e n i ɾ
^volver$	b o l β ɛ ɾ
^regresar$	r e ɣ ɾ e s a ɾ
^irse$	i ɾ s e
^marcharse$	m a ɾ tʃ a ɾ s e
^partir$	p a ɾ t i ɾ
^desaparecer$	d e s a p a ɾ e s ɛ ɾ
^huir$	w i ɾ
^seguir$	s e ɣ i ɾ
^perseguir$	p ɛ ɾ s e ɣ i ɾ
^llegar$	ɟ ʝ e ɣ a ɾ
^alcanzar$	a l k a n s a ɾ
^acercarse$	a s ɛ ɾ k a ɾ s e
^aproximarse$	a p ɾ o k s i m a ɾ s e
^entrar$	e n t ɾ a ɾ
^llevar$	ɟ ʝ e β a ɾ
^cargar$	k a ɾ ɣ a ɾ
^llevar_en_la_mano$	ɟ ʝ e β a ɾ + e n + l a + m a n o
^llevar_a_la_espalda$	ɟ ʝ e β a ɾ + a + l a + ɛ s p a l d a
^en_el_hombro$	ɛ n + ɛ l + o m b ɾ o
^llevar_sobre_la_cabeza$	ɟ ʝ e β a ɾ + s o β ɾ e + l a + k a β e s a
^llevar_bajo_el_brazo$	ɟ ʝ e β a ɾ + β a x o + ɛ l + β ɾ a s o
^traer$	t ɾ a ɛ ɾ
^enviar$	e m b j a ɾ
^mandar$	m a n d a ɾ
^guiar$	ɡ j a ɾ
^conducir$	k o n d u s i ɾ
^conducir$	k o n d u s i ɾ
^montar$	m o n t a ɾ
^empujar$	e m p u x a ɾ
^carretera$	k a r ɛ t ɛ ɾ a
^camino$	k a m i n o
^senda$	s e n d a
^puente$	p w e n t e
^carro$	k a r o
^carretón$	k a r ɛ t o n
^rueda$	r w e ð a
^eje$	e x e
^yugo$	ɟ ʝ u ɣ o
^buque$	b u k e
^barco$	b a ɾ k o
^bote$	b o t e
^canoa$	k a n o a
^batanga$	b a t a n ɡ a
^balsa$	b a l s a
^remo$	r e m o
^remo_corto$	r e m o + k o ɾ t o
^remar$	r e m a ɾ
^timón$	t i m o n
^mástil$	m a s t i l
^vela$	b e l a
^ancla$	a n k l a
^puerto$	p w ɛ ɾ t o
^desembarcar$	d e s e m b a ɾ k a ɾ
^tener$	t e n ɛ ɾ
^poseer$	p o s e ɛ ɾ
^tener$	t e n ɛ ɾ
^tomar$	t o m a ɾ
^coger$	k o x ɛ ɾ
^agarrar$	a ɣ a r a ɾ
^empuɲar$	e m p u ɲ a ɾ
^coger$	k o x ɛ ɾ
^asir$	a s i ɾ
^tener$	t e n ɛ ɾ
^apoyar$	a p o ʝ a ɾ
^obtener$	o β t e n ɛ ɾ
^conseguir$	k o n s e ɣ i ɾ
^conservar$	k o n s ɛ ɾ β a ɾ
^retener$	r ɛ t e n ɛ ɾ
^guardar$	ɡ w a ɾ ð a ɾ
^cosa$	k o s a
^dar$	d a ɾ
^devolver$	d e β o l β ɛ ɾ
^conservar$	k o n s ɛ ɾ β a ɾ
^proteger$	p ɾ o t e x ɛ ɾ
^salvar$	s a l β a ɾ
^rescatar$	r ɛ s k a t a ɾ
^destruir$	d ɛ s t ɾ w i ɾ
^daɲar$	d a ɲ a ɾ
^herir$	ɛ ɾ i ɾ
^buscar$	b u s k a ɾ
^encontrar$	e n k o n t ɾ a ɾ
^hallar$	a ʝ a ɾ
^perder$	p ɛ ɾ ð ɛ ɾ
^soltar$	s o l t a ɾ
^largar$	l a ɾ ɣ a ɾ
^dinero$	d i n ɛ ɾ o
^moneda$	m o n e ð a
^rico$	r i k o
^pobre$	p o β ɾ e
^mendigo$	m e n d i ɣ o
^avaro$	a β a ɾ o
^mezquino$	m ɛ s k i n o
^prestar$	p ɾ ɛ s t a ɾ
^pedir_prestado$	p e ð i ɾ + p ɾ ɛ s t a ð o
^deber$	d e β ɛ ɾ
^deuda$	d e u ð a
^pagar$	p a ɣ a ɾ
^calcul$	k a l k u l
^cuenta$	k w e n t a
^impuesto$	i m p w ɛ s t o
^tributo$	t ɾ i β u t o
^alquilar$	a l k i l a ɾ
^emplear$	e m p l e a ɾ
^salario$	s a l a ɾ j o
^sueldo$	s w ɛ l d o
^ganar$	ɡ a n a ɾ
^comprar$	k o m p ɾ a ɾ
^vender$	b e n d ɛ ɾ
^trocar$	t ɾ o k a ɾ
^comerciante$	k o m ɛ ɾ s j a n t e
^mercado$	m ɛ ɾ k a ð o
^tienda$	t j e n d a
^almacén$	a l m a s e n
^precio$	p ɾ e s j o
^caro$	k a ɾ o
^barato$	b a ɾ a t o
^repartir$	r e p a ɾ t i ɾ
^distribuir$	d i s t ɾ i β w i ɾ
^pesar$	p e s a ɾ
^después$	d ɛ s p w e s
^atrás$	a t ɾ a s
^detrás$	d ɛ t ɾ a s
^lugar$	l u ɣ a ɾ
^sitio$	s i t j o
^poner$	p o n ɛ ɾ
^sentar$	s e n t a ɾ
^acostarse$	a k o s t a ɾ s e
^echarse$	e tʃ a ɾ s e
^poner_de_pie$	p o n ɛ ɾ + ð e + p j e
^quedar$	k e ð a ɾ
^permanecer$	p ɛ ɾ m a n e s ɛ ɾ
^sobras$	s o β ɾ a s
^al_lado_de$	a l + l a ð o + ð e
^recoger$	r e k o x ɛ ɾ
^reunir$	r e u n i ɾ
^recoger$	r e k o x ɛ ɾ
^amontonar$	a m o n t o n a ɾ
^juntar$	x u n t a ɾ
^unir$	u n i ɾ
^separar$	s e p a ɾ a ɾ
^apartar$	a p a ɾ t a ɾ
^dividir$	d i β i ð i ɾ
^abrir$	a β ɾ i ɾ
^cerrar$	s ɛ r a ɾ
^cubrir$	k u β ɾ i ɾ
^esconder$	ɛ s k o n d ɛ ɾ
^abajo$	a β a x o
^bajo$	b a x o
^debajo$	d e β a x o
^alto$	a l t o
^elevado$	e l e β a ð o
^bajo$	b a x o
^cima$	s i m a
^fondo$	f o n d o
^final$	f i n a l
^extremo$	ɛ k s t ɾ e m o
^puntiagudo$	p u n t j a ɣ u ð o
^borde$	b o ɾ ð e
^orilla$	o ɾ i ʝ a
^margen$	m a ɾ x e n
^lado$	l a ð o
^costado$	k o s t a ð o
^medio$	m e ð j o
^centro$	s e n t ɾ o
^delante$	d e l a n t e
^antes_de$	a n t e s + ð e
^delantero$	d e l a n t ɛ ɾ o
^delante$	d e l a n t e
^derecha$	d ɛ ɾ e tʃ a
^izquierda$	i s k j ɛ ɾ ð a
^cerca$	s ɛ ɾ k a
^próximo$	p ɾ o k s i m o
^lejos$	l e x o s
^este$	ɛ s t e
^levante$	l e β a n t e
^oeste$	o ɛ s t e
^poniente$	p o n j e n t e
^norte$	n o ɾ t e
^sur$	s u ɾ
^adentro$	a ð e n t ɾ o
^dentro$	d e n t ɾ o
^crecer$	k ɾ e s ɛ ɾ
^medir$	m e ð i ɾ
^braza$	b ɾ a s a
^grande$	ɡ ɾ a n d e
^chico$	tʃ i k o
^pequeɲo$	p e k e ɲ o
^largo$	l a ɾ ɣ o
^alto$	a l t o
^corto$	k o ɾ t o
^afuera$	a f w ɛ ɾ a
^fuera$	f w ɛ ɾ a
^exterior$	ɛ k s t ɛ ɾ j o ɾ
^ancho$	a n tʃ o
^amplio$	a m p l j o
^angosto$	a n ɡ o s t o
^estrecho$	ɛ s t ɾ e tʃ o
^grueso$	ɡ ɾ w e s o
^delgado$	d ɛ l ɣ a ð o
^profundo$	p ɾ o f u n d o
^hondo$	o n d o
^bajo$	b a x o
^poco_profundo$	p o k o + p ɾ o f u n d o
^debajo$	d e β a x o
^plano$	p l a n o
^derecho$	d ɛ ɾ e tʃ o
^recto$	r e k t o
^torcido$	t o ɾ s i ð o
^gancho$	ɡ a n tʃ o
^esquina$	ɛ s k i n a
^rincón$	r i n k o n
^cruz$	k ɾ u s
^cuadrado$	k w a ð ɾ a ð o
^arriba$	a r i β a
^encima$	e n s i m a
^redondo$	r e ð o n d o
^círculo$	s i ɾ k u l o
^pelota$	p e l o t a
^esfera$	ɛ s f ɛ ɾ a
^globo$	ɡ l o β o
^línea$	l i n e a
^agujero$	a ɣ u x ɛ ɾ o
^semejante$	s e m e x a n t e
^parecido$	p a ɾ e s i ð o
^cambiar$	k a m b j a ɾ
^mudar$	m u ð a ɾ
^cero$	s ɛ ɾ o
^nada$	n a ð a
^uno$	u n o
^diez$	d j e s
^once$	o n s e
^doce$	d o s e
^quince$	k i n s e
^veinte$	b e i n t e
^ciento$	s j e n t o
^cien$	s j e n
^mil$	m i l
^contar$	k o n t a ɾ
^cada$	k a ð a
^todo$	t o ð o
^mucho$	m u tʃ o
^más$	m a s
^poco$	p o k o
^bastante$	b a s t a n t e
^suficiente$	s u f i s j e n t e
^un_poco$	u m + p o k o
^algo$	a l ɣ o
^alguno$	a l ɣ u n o
^multitud$	m u l t i t u ð
^dos$	d o s
^lleno$	ɟ ʝ e n o
^vacío$	b a s i o
^pedazo$	p e ð a s o
^parte$	p a ɾ t e
^mitad$	m i t a ð
^tres$	t ɾ e s
^solo$	s o l o
^solamente$	s o l a m e n t e
^primero$	p ɾ i m ɛ ɾ o
^último$	u l t i m o
^segundo$	s e ɣ u n d o
^par$	p a ɾ
^dos_veces$	d o s + β e s e s
^cuatro$	k w a t ɾ o
^tercero$	t ɛ ɾ s ɛ ɾ o
^tres_veces$	t ɾ e s + β e s e s
^cinco$	s i n k o
^seis$	s e i s
^siete$	s j ɛ t e
^ocho$	o tʃ o
^nueve$	n w e β e
^tiempo$	t j e m p o
^edad$	e ð a ð
^nuevo$	n w e β o
^tierno$	t j ɛ ɾ n o
^joven$	x o β e n
^viejo$	b j e x o
^temprano$	t e m p ɾ a n o
^tarde$	t a ɾ ð e
^ahora$	a o ɾ a
^en_seguida$	e n + s e ɣ i ð a
^inmediatamente$	i m m e ð j a t a m e n t e
^rápido$	r a p i ð o
^despacio$	d ɛ s p a s j o
^lentamente$	l e n t a m e n t e
^apurarse$	a p u ɾ a ɾ s e
^darse_prisa$	d a ɾ s e + p ɾ i s a
^demorar$	d e m o ɾ a ɾ
^retrasar$	r ɛ t ɾ a s a ɾ
^tardar$	t a ɾ ð a ɾ
^empezar$	e m p e s a ɾ
^comenzar$	k o m e n s a ɾ
^inicio$	i n i s j o
^durar$	d u ɾ a ɾ
^fin$	f i n
^acabar$	a k a β a ɾ
^terminar$	t ɛ ɾ m i n a ɾ
^finalizar$	f i n a l i s a ɾ
^terminar$	t ɛ ɾ m i n a ɾ
^detenerse$	d ɛ t e n ɛ ɾ s e
^cesar$	s e s a ɾ
^listo$	l i s t o
^preparado$	p ɾ e p a ɾ a ð o
^siempre$	s j e m p ɾ e
^a_menudo$	a + m e n u ð o
^frecuentemente$	f ɾ e k w e n t e m e n t e
^a_veces$	a + β e s e s
^pronto$	p ɾ o n t o
^por_mucho_tiempo$	p o ɾ + m u tʃ o + t j e m p o
^nunca$	n u n k a
^jamás$	x a m a s
^otra_vez$	o t ɾ a + β e s
^de_nuevo$	d e + n w e β o
^día$	d i a
^noche$	n o tʃ e
^madrugada$	m a ð ɾ u ɣ a ð a
^amanecer$	a m a n e s ɛ ɾ
^maɲana$	m a ɲ a n a
^mediodía$	m e ð j o ð i a
^tarde$	t a ɾ ð e
^vísperas$	b i s p ɛ ɾ a s
^noche$	n o tʃ e
^hoy$	o i
^maɲana$	m a ɲ a n a
^pasado_maɲana$	p a s a ð o + m a ɲ a n a
^ayer$	a ʝ ɛ ɾ
^anteayer$	a n t e a ʝ ɛ ɾ
^hora$	o ɾ a
^reloj$	r e l o x
^semana$	s e m a n a
^domingo$	d o m i n ɡ o
^lunes$	l u n e s
^martes$	m a ɾ t e s
^miércoles$	m j ɛ ɾ k o l e s
^jueves$	x w e β e s
^viernes$	b j ɛ ɾ n e s
^sábado$	s a β a ð o
^mes$	m e s
^aɲo$	a ɲ o
^invierno$	i m b j ɛ ɾ n o
^primavera$	p ɾ i m a β ɛ ɾ a
^verano$	b ɛ ɾ a n o
^otoɲo$	o t o ɲ o
^estación$	ɛ s t a s j o n
^oler$	o l ɛ ɾ
^olfatear$	o l f a t e a ɾ
^husmear$	u s m e a ɾ
^oler$	o l ɛ ɾ
^olfatear$	o l f a t e a ɾ
^fragante$	f ɾ a ɣ a n t e
^bien_oliente$	b j ɛ n + o l j e n t e
^hediondo$	e ð j o n d o
^gustar$	ɡ u s t a ɾ
^saborear$	s a β o ɾ e a ɾ
^dulce$	d u l s e
^salado$	s a l a ð o
^amargo$	a m a ɾ ɣ o
^ácido$	a s i ð o
^agrio$	a ɣ ɾ j o
^salobre$	s a l o β ɾ e
^oír$	o i ɾ
^escuchar$	ɛ s k u tʃ a ɾ
^sonido$	s o n i ð o
^ruido$	r w i ð o
^alta$	a l t a
^ruidoso$	r w i ð o s o
^silencio$	s i l e n s j o
^tranquilo$	t ɾ a n k i l o
^ver$	b ɛ ɾ
^mirar$	m i ɾ a ɾ
^contemplar$	k o n t e m p l a ɾ
^mostrar$	m o s t ɾ a ɾ
^seɲalar$	s e ɲ a l a ɾ
^brillar$	b ɾ i ʝ a ɾ
^brillante$	b ɾ i ʝ a n t e
^resplandor$	r ɛ s p l a n d o ɾ
^color$	k o l o ɾ
^claro$	k l a ɾ o
^oscuro$	o s k u ɾ o
^blanco$	b l a n k o
^negro$	n e ɣ ɾ o
^rojo$	r o x o
^azul$	a s u l
^verde$	b ɛ ɾ ð e
^amarillo$	a m a ɾ i ʝ o
^tocar$	t o k a ɾ
^pellizcar$	p e ʝ i s k a ɾ
^sentir$	s e n t i ɾ
^duro$	d u ɾ o
^suave$	s w a β e
^áspero$	a s p ɛ ɾ o
^suave$	s w a β e
^liso$	l i s o
^afilado$	a f i l a ð o
^aguzado$	a ɣ u s a ð o
^filoso$	f i l o s o
^romo$	r o m o
^embotado$	e m b o t a ð o
^pesado$	p e s a ð o
^liviano$	l i β j a n o
^ligero$	l i x ɛ ɾ o
^mojado$	m o x a ð o
^húmedo$	u m e ð o
^seco$	s e k o
^caliente$	k a l j e n t e
^tibio$	t i β j o
^cálido$	k a l i ð o
^frío$	f ɾ i o
^limpio$	l i m p j o
^sucio$	s u s j o
^arrugado$	a r u ɣ a ð o
^alma$	a l m a
^sorprendido$	s o ɾ p ɾ e n d i ð o
^estupefacto$	ɛ s t u p e f a k t o
^buena_suerte$	b w e n a + s w ɛ ɾ t e
^mala_suerte$	m a l a + s w ɛ ɾ t e
^alegre$	a l e ɣ ɾ e
^contento$	k o n t e n t o
^feliz$	f e l i s
^reír$	r e i ɾ
^sonreír$	s o n r e i ɾ
^jugar$	x u ɣ a ɾ
^querer$	k ɛ ɾ ɛ ɾ
^amar$	a m a ɾ
^besar$	b e s a ɾ
^abrazar$	a β ɾ a s a ɾ
^dolor$	d o l o ɾ
^tristeza$	t ɾ i s t e s a
^dolor$	d o l o ɾ
^pena$	p e n a
^ansiedad$	a n s j e ð a ð
^angustia$	a n ɡ u s t j a
^preocupación$	p ɾ e o k u p a s j o n
^lamentar$	l a m e n t a ɾ
^sentir$	s e n t i ɾ
^compasión$	k o m p a s j o n
^lástima$	l a s t i m a
^llorar$	ɟ ʝ o ɾ a ɾ
^lágrima$	l a ɣ ɾ i m a
^gemir$	x e m i ɾ
^odiar$	o ð j a ɾ
^enojo$	e n o x o
^ira$	i ɾ a
^rabia$	r a β j a
^envidia$	e m b i ð j a
^celos$	s e l o s
^vergüenza$	b ɛ ɾ ɣ w e n s a
^orgulloso$	o ɾ ɣ u ʝ o s o
^osar$	o s a ɾ
^atreverse$	a t ɾ e β ɛ ɾ s e
^valiente$	b a l j e n t e
^miedo$	m j e ð o
^susto$	s u s t o
^peligro$	p e l i ɣ ɾ o
^anhelar$	a n e l a ɾ
^desear$	d e s e a ɾ
^escoger$	ɛ s k o x ɛ ɾ
^elegir$	e l e x i ɾ
^esperanza$	ɛ s p ɛ ɾ a n s a
^fiel$	f j ɛ l
^verdadero$	b ɛ ɾ ð a ð ɛ ɾ o
^mentir$	m e n t i ɾ
^engaɲo$	e n ɡ a ɲ o
^perdonar$	p ɛ ɾ ð o n a ɾ
^bueno$	b w e n o
^malo$	m a l o
^correcto$	k o r e k t o
^incorrecto$	i n k o r e k t o
^falso$	f a l s o
^culpa$	k u l p a
^equivocación$	e k i β o k a s j o n
^error$	ɛ r o ɾ
^culpa$	k u l p a
^censura$	s e n s u ɾ a
^exaltar$	ɛ k s a l t a ɾ
^alabar$	a l a β a ɾ
^hermoso$	ɛ ɾ m o s o
^bonito$	b o n i t o
^lindo$	l i n d o
^feo$	f e o
^codicioso$	k o ð i s j o s o
^voraz$	b o ɾ a s
^hábil$	a β i l
^capaz$	k a p a s
^mente$	m e n t e
^pensamiento$	p e n s a m j e n t o
^pensar$	p e n s a ɾ
^creer$	k ɾ e ɛ ɾ
^suponer$	s u p o n ɛ ɾ
^creer$	k ɾ e ɛ ɾ
^entender$	e n t e n d ɛ ɾ
^comprender$	k o m p ɾ e n d ɛ ɾ
^saber$	s a β ɛ ɾ
^conocer$	k o n o s ɛ ɾ
^adivinar$	a ð i β i n a ɾ
^acertar$	a s ɛ ɾ t a ɾ
^imitar$	i m i t a ɾ
^parecer$	p a ɾ e s ɛ ɾ
^idea$	i ð e a
^concepto$	k o n s e p t o
^sabio$	s a β j o
^necio$	n e s j o
^estúpido$	ɛ s t u p i ð o
^tonto$	t o n t o
^loco$	l o k o
^insano$	i n s a n o
^aprender$	a p ɾ e n d ɛ ɾ
^estudiar$	ɛ s t u ð j a ɾ
^enseɲar$	e n s e ɲ a ɾ
^alumno$	a l u m n o
^profesor$	p ɾ o f e s o ɾ
^maestro$	m a ɛ s t ɾ o
^escuela$	ɛ s k w e l a
^colegio$	k o l e x j o
^recordar$	r e k o ɾ ð a ɾ
^acordarse$	a k o ɾ ð a ɾ s e
^olvidar$	o l β i ð a ɾ
^claro$	k l a ɾ o
^evidente$	e β i ð e n t e
^obscuro$	o β s k u ɾ o
^secreto$	s e k ɾ ɛ t o
^seguro$	s e ɣ u ɾ o
^cierto$	s j ɛ ɾ t o
^explicar$	ɛ k s p l i k a ɾ
^propósito$	p ɾ o p o s i t o
^intención$	i n t e n s j o n
^causar$	k a u s a ɾ
^dudar$	d u ð a ɾ
^sospechar$	s o s p e tʃ a ɾ
^traicionar$	t ɾ a i s j o n a ɾ
^necesidad$	n e s e s i ð a ð
^fácil$	f a s i l
^difícil$	d i f i s i l
^tratar$	t ɾ a t a ɾ
^probar$	p ɾ o β a ɾ
^modo$	m o ð o
^manera$	m a n ɛ ɾ a
^y$	i
^porque$	p o ɾ k e
^si$	s i
^o$	o
^sí$	s i
^afirmativo$	a f i ɾ m a t i β o
^no$	n o
^negativo$	n e ɣ a t i β o
^cómo$	k o m o
^cuántos$	k w a n t o s
^cuánto$	k w a n t o
^qué$	k e
^cuándo$	k w a n d o
^dónde$	d o n d e
^cuál$	k w a l
^quién$	k j e n
^por_qué$	p o ɾ + k e
^voz$	b o s
^cantar$	k a n t a ɾ
^gritar$	ɡ ɾ i t a ɾ
^cuchichear$	k u tʃ i tʃ e a ɾ
^barbotar$	b a ɾ β o t a ɾ
^hablar_entre_dientes$	a β l a ɾ + e n t ɾ e + ð j e n t e s
^silbar$	s i l β a ɾ
^chiflar$	tʃ i f l a ɾ
^chillar$	tʃ i ʝ a ɾ
^aullar$	a u ʝ a ɾ
^hablar$	a β l a ɾ
^tartamudear$	t a ɾ t a m u ð e a ɾ
^balbucear$	b a l β u s e a ɾ
^decir$	d e s i ɾ
^narrar$	n a r a ɾ
^contar$	k o n t a ɾ
^pronunciar_un_discurso$	p ɾ o n u n s j a ɾ + u n + d i s k u ɾ s o
^callarse$	k a ʝ a ɾ s e
^lengua$	l e n ɡ w a
^idioma$	i ð j o m a
^palabra$	p a l a β ɾ a
^nombre$	n o m b ɾ e
^preguntar$	p ɾ e ɣ u n t a ɾ
^contestar$	k o n t ɛ s t a ɾ
^responder$	r ɛ s p o n d ɛ ɾ
^admitir$	a ð m i t i ɾ
^confesar$	k o m f e s a ɾ
^reconocer$	r e k o n o s ɛ ɾ
^negar$	n e ɣ a ɾ
^pedir$	p e ð i ɾ
^prometer$	p ɾ o m ɛ t ɛ ɾ
^rehusar$	r e u s a ɾ
^prohibir$	p ɾ o i β i ɾ
^reprender$	r e p ɾ e n d ɛ ɾ
^llamar$	ɟ ʝ a m a ɾ
^llamarse$	ɟ ʝ a m a ɾ s e
^anunciar$	a n u n s j a ɾ
^avisar$	a β i s a ɾ
^amenazar$	a m e n a s a ɾ
^jactarse$	x a k t a ɾ s e
^escribir$	ɛ s k ɾ i β i ɾ
^leer$	l e ɛ ɾ
^papel$	p a p ɛ l
^pluma$	p l u m a
^libro$	l i β ɾ o
^poeta$	p o ɛ t a
^flauta$	f l a u t a
^bombo$	b o m b o
^tambor$	t a m b o ɾ
^trompeta$	t ɾ o m p ɛ t a
^trompa$	t ɾ o m p a
^corneta$	k o ɾ n ɛ t a
^matraca$	m a t ɾ a k a
^cascabel$	k a s k a β ɛ l
^país$	p a i s
^patria$	p a t ɾ j a
^ciudad$	s j u ð a ð
^pueblo$	p w e β l o
^límite$	l i m i t e
^frontera$	f ɾ o n t ɛ ɾ a
^pueblo$	p w e β l o
^gente$	x e n t e
^tribu$	t ɾ i β u
^clan$	k l a n
^jefe$	x e f e
^cacique$	k a s i k e
^bastón$	b a s t o n
^bordón$	b o ɾ ð o n
^gobernar$	ɡ o β ɛ ɾ n a ɾ
^rey$	r e i
^gobernante$	ɡ o β ɛ ɾ n a n t e
^reina$	r e i n a
^noble$	n o β l e
^ciudadano$	s j u ð a ð a n o
^súbdito$	s u β ð i t o
^amo$	a m o
^dueɲo$	d w e ɲ o
^patrón$	p a t ɾ o n
^esclavo$	ɛ s k l a β o
^sirviente$	s i ɾ β j e n t e
^criado$	k ɾ j a ð o
^hombre_libre$	o m b ɾ e + l i β ɾ e
^mandar$	m a n d a ɾ
^ordenar$	o ɾ ð e n a ɾ
^obedecer$	o β e ð e s ɛ ɾ
^permitir$	p ɛ ɾ m i t i ɾ
^dejar$	d e x a ɾ
^amigo$	a m i ɣ o
^compaɲero$	k o m p a ɲ ɛ ɾ o
^enemigo$	e n e m i ɣ o
^vecino$	b e s i n o
^extranjero$	ɛ k s t ɾ a n x ɛ ɾ o
^forastero$	f o ɾ a s t ɛ ɾ o
^huésped$	w ɛ s p ɛ ð
^invitado$	i m b i t a ð o
^huésped$	w ɛ s p ɛ ð
^hospedero$	o s p e ð ɛ ɾ o
^ayudar$	a ʝ u ð a ɾ
^impedir$	i m p e ð i ɾ
^estorbar$	ɛ s t o ɾ β a ɾ
^costumbre$	k o s t u m b ɾ e
^hábito$	a β i t o
^lucha$	l u tʃ a
^pleito$	p l e i t o
^disputa$	d i s p u t a
^conspiración$	k o n s p i ɾ a s j o n
^encontrar$	e n k o n t ɾ a ɾ
^prostituta$	p ɾ o s t i t u t a
^persona$	p ɛ ɾ s o n a
^hombre$	o m b ɾ e
^mujer$	m u x ɛ ɾ
^varón$	b a ɾ o n
^macho$	m a tʃ o
^hembra$	e m b ɾ a
^muchacho$	m u tʃ a tʃ o
^el_joven$	ɛ l + x o β e n
^muchacha$	m u tʃ a tʃ a
^la_joven$	l a + x o β e n
^niɲo$	n i ɲ o
^niɲo$	n i ɲ o
^bebé$	b e β e
^nene$	n e n e
^marido$	m a ɾ i ð o
^esposo$	ɛ s p o s o
^esposa$	ɛ s p o s a
^casarse$	k a s a ɾ s e
^casamiento$	k a s a m j e n t o
^boda$	b o ð a
^divorcio$	d i β o ɾ s j o
^padre$	p a ð ɾ e
^madre$	m a ð ɾ e
^padres$	p a ð ɾ e s
^hombre_casado$	o m b ɾ e + k a s a ð o
^mujer_casada$	m u x ɛ ɾ + k a s a ð a
^hijo$	i x o
^hija$	i x a
^hijo$	i x o
^hija$	i x a
^hermano$	ɛ ɾ m a n o
^hermano_mayor$	ɛ ɾ m a n o + m a ʝ o ɾ
^hermano_menor$	ɛ ɾ m a n o + m e n o ɾ
^hermana$	ɛ ɾ m a n a
^hermana_mayor$	ɛ ɾ m a n a + m a ʝ o ɾ
^hermana_menor$	ɛ ɾ m a n a + m e n o ɾ
^hermano$	ɛ ɾ m a n o
^hermana$	ɛ ɾ m a n a
^gemelos$	x e m e l o s
^mellizo$	m e ʝ i s o
^abuelo$	a β w e l o
^anciano$	a n s j a n o
^hombre_viejo$	o m b ɾ e + β j e x o
^abuela$	a β w e l a
^anciana$	a n s j a n a
^mujer_vieja$	m u x ɛ ɾ + β j e x a
^nieto$	n j ɛ t o
^nieta$	n j ɛ t a
^tío$	t i o
^hermano_de_la_madre$	ɛ ɾ m a n o + ð e + l a + m a ð ɾ e
^hermano_del_padre$	ɛ ɾ m a n o + ð ɛ l + p a ð ɾ e
^tía$	t i a
^hermana_de_la_madre$	ɛ ɾ m a n a + ð e + l a + m a ð ɾ e
^hermana_del_padre$	ɛ ɾ m a n a + ð ɛ l + p a ð ɾ e
^sobrino$	s o β ɾ i n o
^sobrina$	s o β ɾ i n a
^primo$	p ɾ i m o
^prima$	p ɾ i m a
^antepasados$	a n t e p a s a ð o s
^descendientes$	d e s e n d j e n t e s
^suegro$	s w e ɣ ɾ o
^suegro$	s w e ɣ ɾ o
^suegra$	s w e ɣ ɾ a
^suegra$	s w e ɣ ɾ a
^yerno$	ɟ ʝ ɛ ɾ n o
^yerno$	ɟ ʝ ɛ ɾ n o
^nuera$	n w ɛ ɾ a
^nuera$	n w ɛ ɾ a
^padrastro$	p a ð ɾ a s t ɾ o
^madrastra$	m a ð ɾ a s t ɾ a
^hijastro$	i x a s t ɾ o
^entenado$	e n t e n a ð o
^hijastra$	i x a s t ɾ a
^entenada$	e n t e n a ð a
^huérfano$	w ɛ ɾ f a n o
^huérfana$	w ɛ ɾ f a n a
^viuda$	b j u ð a
^viudo$	b j u ð o
^parientes$	p a ɾ j e n t e s
^parentela$	p a ɾ e n t e l a
^familia$	f a m i l j a
^yo$	ɟ ʝ o
^tú$	t u
^usted$	u s t ɛ ð
^él$	ɛ l
^ella$	e ʝ a
^ello$	e ʝ o
^nosotros$	n o s o t ɾ o s
^nosotras$	n o s o t ɾ a s
^nosotros$	n o s o t ɾ o s
^nosotras$	n o s o t ɾ a s
^nosotros$	n o s o t ɾ o s
^nosotras$	n o s o t ɾ a s
^ustedes$	u s t e ð e s
^ellos$	e ʝ o s
^ellas$	e ʝ a s
^pelear$	p e l e a ɾ
^guerra$	ɡ ɛ r a
^batalla$	b a t a ʝ a
^paz$	p a s
^ejército$	e x ɛ ɾ s i t o
^tropas$	t ɾ o p a s
^soldado$	s o l d a ð o
^armas$	a ɾ m a s
^macana$	m a k a n a
^garrote$	ɡ a r o t e
^hacha_de_combate$	a tʃ a + ð e + k o m b a t e
^honda$	o n d a
^arco$	a ɾ k o
^flecha$	f l e tʃ a
^lanza$	l a n s a
^espada$	ɛ s p a ð a
^escopeta$	ɛ s k o p ɛ t a
^caɲón$	k a ɲ o n
^armadura$	a ɾ m a ð u ɾ a
^yelmo$	ɟ ʝ ɛ l m o
^escudo$	ɛ s k u ð o
^fortaleza$	f o ɾ t a l e s a
^castillo$	k a s t i ʝ o
^torre$	t o r e
^victoria$	b i k t o ɾ j a
^derrota$	d ɛ r o t a
^atacar$	a t a k a ɾ
^defender$	d e f e n d ɛ ɾ
^huir$	w i ɾ
^retirarse$	r ɛ t i ɾ a ɾ s e
^rendirse$	r e n d i ɾ s e
^cautivo$	k a u t i β o
^preso$	p ɾ e s o
^prisionero$	p ɾ i s j o n ɛ ɾ o
^guardia$	ɡ w a ɾ ð j a
^centinela$	s e n t i n e l a
^botín$	b o t i n
^acechar$	a s e tʃ a ɾ
^emboscar$	e m b o s k a ɾ
^pescador$	p ɛ s k a ð o ɾ
^anzuelo$	a n s w e l o
^cuerda_de_pescar$	k w ɛ ɾ ð a + ð e + p ɛ s k a ɾ
^red$	r ɛ ð
^atarraya$	a t a r a ʝ a
^nasa$	n a s a
^cebo$	s e β o
^carnada$	k a ɾ n a ð a
^cazar$	k a s a ɾ
^tirar$	t i ɾ a ɾ
^disparar$	d i s p a ɾ a ɾ
^errar$	ɛ r a ɾ
^fallar$	f a ʝ a ɾ
^trampa$	t ɾ a m p a
^atrapar$	a t ɾ a p a ɾ
^ley$	l e i
^tribunal$	t ɾ i β u n a l
^juzgar$	x u s ɣ a ɾ
^juicio$	x w i s j o
^juez$	x w e s
^demandante$	d e m a n d a n t e
^acusado$	a k u s a ð o
^testigo$	t ɛ s t i ɣ o
^jurar$	x u ɾ a ɾ
^juramento$	x u ɾ a m e n t o
^acusar$	a k u s a ɾ
^denunciar$	d e n u n s j a ɾ
^condenar$	k o n d e n a ɾ
^inculpar$	i n k u l p a ɾ
^condenar$	k o n d e n a ɾ
^absolver$	a β s o l β ɛ ɾ
^exculpar$	ɛ k s k u l p a ɾ
^culpable$	k u l p a β l e
^inocente$	i n o s e n t e
^castigo$	k a s t i ɣ o
^multa$	m u l t a
^cárcel$	k a ɾ s ɛ l
^asesinar$	a s e s i n a ɾ
^matar$	m a t a ɾ
^adulterio$	a ð u l t ɛ ɾ j o
^violación$	b j o l a s j o n
^incendio_premeditado$	i n s e n d j o + p ɾ e m e ð i t a ð o
^perjurio$	p ɛ ɾ x u ɾ j o
^robar$	r o β a ɾ
^ladrón$	l a ð ɾ o n
^religión$	r e l i x j o n
^Dios$	d j o s
^templo$	t e m p l o
^iglesia$	i ɣ l e s j a
^altar$	a l t a ɾ
^ofrenda$	o f ɾ e n d a
^sacrificio$	s a k ɾ i f i s j o
^adorar$	a ð o ɾ a ɾ
^culto$	k u l t o
^orar$	o ɾ a ɾ
^rezar$	r e s a ɾ
^cura$	k u ɾ a
^presbítero$	p ɾ ɛ s β i t ɛ ɾ o
^sacerdote$	s a s ɛ ɾ ð o t e
^sagrado$	s a ɣ ɾ a ð o
^santo$	s a n t o
^predicar$	p ɾ e ð i k a ɾ
^bendecir$	b e n d e s i ɾ
^maldecir$	m a l d e s i ɾ
^ayunar$	a ʝ u n a ɾ
^cielo$	s j e l o
^paraíso$	p a ɾ a i s o
^infierno$	i m f j ɛ ɾ n o
^demonio$	d e m o n j o
^ídolo$	i ð o l o
^brujería$	b ɾ u x ɛ ɾ i a
^hechicería$	e tʃ i s ɛ ɾ i a
^brujo$	b ɾ u x o
^bruja$	b ɾ u x a
^hechicero$	e tʃ i s ɛ ɾ o
^hada$	a ð a
^duende$	d w e n d e
^fantasma$	f a n t a s m a
^agüero$	a ɣ w ɛ ɾ o
^presagio$	p ɾ e s a x j o
^animal$	a n i m a l
^masculino$	m a s k u l i n o
^macho$	m a tʃ o
^femenino$	f e m e n i n o
